{"complete_block_event_count":10,"events":[{"data":["{\"weight\":{\"refTime\":261973000,\"proofSize\":1493},\"class\":\"Mandatory\",\"paysFee\":\"Yes\"}"],"event_index":0,"method":"ExtrinsicSuccess","phase":"{\"applyExtrinsic\":0}","section":"system"},{"data":["5DAAnrj7VHTznn2AWBemMuyBwZWs6FNFjdyVXUeYum3PTXFy","1645885297"],"event_index":1,"method":"Withdraw","phase":"{\"applyExtrinsic\":1}","section":"balances"},{"data":["5DAAnrj7VHTznn2AWBemMuyBwZWs6FNFjdyVXUeYum3PTXFy","4000000000000"],"event_index":2,"method":"Reserved","phase":"{\"applyExtrinsic\":1}","section":"balances"},{"data":["0x46a4eae7091b37de78d4055700694f26450880b7318aaa1657b05dc72923a8a5","0x306721211d5404bd9da88e0204360a1a9ab8b87c66c1bc2fcdd37f3c2222cc20","0x6b9b97db4cd6821d0a7462d21ec6984a5e79097cd7ce6abe09b13efefa25b05c","4000000000000","29"],"event_index":3,"method":"OrderFunded","phase":"{\"applyExtrinsic\":1}","section":"marketRuntime"},{"data":["0x46a4eae7091b37de78d4055700694f26450880b7318aaa1657b05dc72923a8a5","0x6b9b97db4cd6821d0a7462d21ec6984a5e79097cd7ce6abe09b13efefa25b05c","4000000000000"],"event_index":4,"method":"PaymentEscrowed","phase":"{\"applyExtrinsic\":1}","section":"marketRuntime"},{"data":["5DAAnrj7VHTznn2AWBemMuyBwZWs6FNFjdyVXUeYum3PTXFy","1645885297","0"],"event_index":5,"method":"TransactionFeePaid","phase":"{\"applyExtrinsic\":1}","section":"transactionPayment"},{"data":["{\"weight\":{\"refTime\":1645885000,\"proofSize\":12184},\"class\":\"Normal\",\"paysFee\":\"Yes\"}"],"event_index":6,"method":"ExtrinsicSuccess","phase":"{\"applyExtrinsic\":1}","section":"system"},{"data":["5GrwvaEF5zXb26Fz9rcQpDWS57CtERHpNehXCPcNoHGKutQY","5000000000000"],"event_index":7,"method":"Deposit","phase":"Finalization","section":"balances"},{"data":["5000000000000"],"event_index":8,"method":"Issued","phase":"Finalization","section":"balances"},{"data":["5GrwvaEF5zXb26Fz9rcQpDWS57CtERHpNehXCPcNoHGKutQY","5000000000000","19"],"event_index":9,"method":"RewardPaid","phase":"Finalization","section":"rewards"}],"extrinsic_index":1,"included_block_hash":"0xc844b7fb0ca5892b2706c8ff458c28acdd75dcd12ca0904ff17ca3bcf1797c8c","included_block_number":19,"parent_block_hash":"0x586f5329ec0be39c5f3c4b911a87301ccd5e85ec3428b1bbbd202bc54e285e64","parent_block_number":18,"schema_id":"assetxchain-exp2-phase4-attempt-block-evidence","schema_version":1,"terminal_status":"in-block","transaction_event_indexes":[1,2,3,4,5,6],"transaction_hash":"0x3e45ed1aa46220281e1bd30430b159f75f38a8dfcf021d6e3826315e90e441e5"}
