{"complete_block_event_count":13,"events":[{"data":["{\"weight\":{\"refTime\":261973000,\"proofSize\":1493},\"class\":\"Mandatory\",\"paysFee\":\"Yes\"}"],"event_index":0,"method":"ExtrinsicSuccess","phase":"{\"applyExtrinsic\":0}","section":"system"},{"data":["5GNJqTPyNqANBkUVMN1LPPrxXnFouWXoe2wNSmmEoLctxiZY","1001122225190"],"event_index":1,"method":"Withdraw","phase":"{\"applyExtrinsic\":1}","section":"balances"},{"data":["5FLSigC9HGRKVhB9FiEo4Y3koPsNmBmLJbpXg2mp1hXcS59Y","5GrwvaEF5zXb26Fz9rcQpDWS57CtERHpNehXCPcNoHGKutQY","10000000000000","Free"],"event_index":2,"method":"ReserveRepatriated","phase":"{\"applyExtrinsic\":1}","section":"balances"},{"data":["0x1c7dd8ce16784689fff47efc23da25ec3700b57952247d1ab8a37ba51e780d11","0x1144e363ae36fc6b722a98ebeb9d7bf046e6ecf8eaf62f4263716773acfc139a","0xe4976ff92040cb92f209a7b0565b2bebb6e3995a57497bea0138af0eb5e94a15"],"event_index":3,"method":"SettlementFinalized","phase":"{\"applyExtrinsic\":1}","section":"dataAssets"},{"data":["{\"signed\":\"5GNJqTPyNqANBkUVMN1LPPrxXnFouWXoe2wNSmmEoLctxiZY\"}","5Cm1sZGQqbtfg7hH4o4feTtv4QjgktgLavxEdjcEEH9SnETx"],"event_index":4,"method":"Called","phase":"{\"applyExtrinsic\":1}","section":"contracts"},{"data":["5GNJqTPyNqANBkUVMN1LPPrxXnFouWXoe2wNSmmEoLctxiZY","997596647635"],"event_index":5,"method":"Deposit","phase":"{\"applyExtrinsic\":1}","section":"balances"},{"data":["5GNJqTPyNqANBkUVMN1LPPrxXnFouWXoe2wNSmmEoLctxiZY","3525577555","0"],"event_index":6,"method":"TransactionFeePaid","phase":"{\"applyExtrinsic\":1}","section":"transactionPayment"},{"data":["{\"weight\":{\"refTime\":3525577365,\"proofSize\":78021},\"class\":\"Normal\",\"paysFee\":\"Yes\"}"],"event_index":7,"method":"ExtrinsicSuccess","phase":"{\"applyExtrinsic\":1}","section":"system"},{"data":["0xb0a05cc05bd3c24049a49925deb3daf197f306ae1ab9e5cfc1a149b415794341"],"event_index":8,"method":"AssetRootUpdated","phase":"Finalization","section":"dataAssets"},{"data":["0x03170a2e7597b7b7e3d84c05391d139a62b157e78786d8c082f29dcf4c111314"],"event_index":9,"method":"CertificateRootUpdated","phase":"Finalization","section":"dataAssets"},{"data":["5GrwvaEF5zXb26Fz9rcQpDWS57CtERHpNehXCPcNoHGKutQY","5000000000000"],"event_index":10,"method":"Deposit","phase":"Finalization","section":"balances"},{"data":["5000000000000"],"event_index":11,"method":"Issued","phase":"Finalization","section":"balances"},{"data":["5GrwvaEF5zXb26Fz9rcQpDWS57CtERHpNehXCPcNoHGKutQY","5000000000000","21"],"event_index":12,"method":"RewardPaid","phase":"Finalization","section":"rewards"}],"extrinsic_index":1,"included_block_hash":"0xf5685fd16c095d5201b0fcac2e2149ef89e053a331de80d44f13c08514091384","included_block_number":21,"parent_block_hash":"0x2d8420f372d8520f910aff2f68513f2e3542a03db18d75ce44f9df0496abf545","parent_block_number":20,"schema_id":"assetxchain-exp2-phase4-attempt-block-evidence","schema_version":1,"terminal_status":"in-block","transaction_event_indexes":[1,2,3,4,5,6,7],"transaction_hash":"0x770b2f40d396da14f7b49d874735825ca235793f98967b42e782ee71b4175444"}
