{"complete_block_event_count":8,"events":[{"data":["{\"weight\":{\"refTime\":261973000,\"proofSize\":1493},\"class\":\"Mandatory\",\"paysFee\":\"Yes\"}"],"event_index":0,"method":"ExtrinsicSuccess","phase":"{\"applyExtrinsic\":0}","section":"system"},{"data":["5GNJqTPyNqANBkUVMN1LPPrxXnFouWXoe2wNSmmEoLctxiZY","1001122225610"],"event_index":1,"method":"Withdraw","phase":"{\"applyExtrinsic\":1}","section":"balances"},{"data":["5GNJqTPyNqANBkUVMN1LPPrxXnFouWXoe2wNSmmEoLctxiZY","998848782181"],"event_index":2,"method":"Deposit","phase":"{\"applyExtrinsic\":1}","section":"balances"},{"data":["5GNJqTPyNqANBkUVMN1LPPrxXnFouWXoe2wNSmmEoLctxiZY","2273443429","0"],"event_index":3,"method":"TransactionFeePaid","phase":"{\"applyExtrinsic\":1}","section":"transactionPayment"},{"data":["{\"module\":{\"index\":14,\"error\":\"0x1b000000\"}}","{\"weight\":{\"refTime\":2273442819,\"proofSize\":59597},\"class\":\"Normal\",\"paysFee\":\"Yes\"}"],"event_index":4,"method":"ExtrinsicFailed","phase":"{\"applyExtrinsic\":1}","section":"system"},{"data":["5GrwvaEF5zXb26Fz9rcQpDWS57CtERHpNehXCPcNoHGKutQY","5000000000000"],"event_index":5,"method":"Deposit","phase":"Finalization","section":"balances"},{"data":["5000000000000"],"event_index":6,"method":"Issued","phase":"Finalization","section":"balances"},{"data":["5GrwvaEF5zXb26Fz9rcQpDWS57CtERHpNehXCPcNoHGKutQY","5000000000000","20"],"event_index":7,"method":"RewardPaid","phase":"Finalization","section":"rewards"}],"extrinsic_index":1,"included_block_hash":"0xadc48f249ebe3a355a21400f70a01a8f83187ccd60950cd6f006fc743fb06810","included_block_number":20,"parent_block_hash":"0x27d15b608cd8b85fd4ced5b2df098320289f0ee7c36e23667d29e5119065fed0","parent_block_number":19,"schema_id":"assetxchain-exp2-phase4-attempt-block-evidence","schema_version":1,"terminal_status":"in-block","transaction_event_indexes":[1,2,3,4],"transaction_hash":"0x2822076346d5d7845b91a40acf2ce1c99b507a3132027b4795723a2b54223e6d"}
