{"complete_block_event_count":10,"events":[{"data":["{\"weight\":{\"refTime\":261973000,\"proofSize\":1493},\"class\":\"Mandatory\",\"paysFee\":\"Yes\"}"],"event_index":0,"method":"ExtrinsicSuccess","phase":"{\"applyExtrinsic\":0}","section":"system"},{"data":["5GNJqTPyNqANBkUVMN1LPPrxXnFouWXoe2wNSmmEoLctxiZY","4870032054"],"event_index":1,"method":"Withdraw","phase":"{\"applyExtrinsic\":1}","section":"balances"},{"data":["5FM5evkQGqs7iTZ92mkDczQNiKRHS9GBE1VZUCL4cCvYGL5r","0x3145f3797456aa9d8bb5ad2fb8038d013fdabcff81bb845b5065d82ad44038a10ca8e4f7e6074dec80d0b65475e9f6d73c356f4c9489e7c8e33cc06e34d231df006161616161616161616161616161616161616161616161616161616161616161"],"event_index":2,"method":"ContractEmitted","phase":"{\"applyExtrinsic\":1}","section":"contracts"},{"data":["{\"signed\":\"5GNJqTPyNqANBkUVMN1LPPrxXnFouWXoe2wNSmmEoLctxiZY\"}","5FM5evkQGqs7iTZ92mkDczQNiKRHS9GBE1VZUCL4cCvYGL5r"],"event_index":3,"method":"Called","phase":"{\"applyExtrinsic\":1}","section":"contracts"},{"data":["5GNJqTPyNqANBkUVMN1LPPrxXnFouWXoe2wNSmmEoLctxiZY","5FM5evkQGqs7iTZ92mkDczQNiKRHS9GBE1VZUCL4cCvYGL5r","28920000000000"],"event_index":4,"method":"StorageDepositTransferredAndHeld","phase":"{\"applyExtrinsic\":1}","section":"contracts"},{"data":["5GNJqTPyNqANBkUVMN1LPPrxXnFouWXoe2wNSmmEoLctxiZY","4870032054","0"],"event_index":5,"method":"TransactionFeePaid","phase":"{\"applyExtrinsic\":1}","section":"transactionPayment"},{"data":["{\"weight\":{\"refTime\":4870031445,\"proofSize\":370110},\"class\":\"Normal\",\"paysFee\":\"Yes\"}"],"event_index":6,"method":"ExtrinsicSuccess","phase":"{\"applyExtrinsic\":1}","section":"system"},{"data":["5GrwvaEF5zXb26Fz9rcQpDWS57CtERHpNehXCPcNoHGKutQY","5000000000000"],"event_index":7,"method":"Deposit","phase":"Finalization","section":"balances"},{"data":["5000000000000"],"event_index":8,"method":"Issued","phase":"Finalization","section":"balances"},{"data":["5GrwvaEF5zXb26Fz9rcQpDWS57CtERHpNehXCPcNoHGKutQY","5000000000000","18"],"event_index":9,"method":"RewardPaid","phase":"Finalization","section":"rewards"}],"extrinsic_index":1,"included_block_hash":"0x36187762f0b45c05d9abacd0cb338abc89fefd0aedb1113d856b68c973fb31ed","included_block_number":18,"parent_block_hash":"0xf292e145df6d89ee2bab11f9bed89ebb84ec290f6dc73e33117a1cf75f1daa5e","parent_block_number":17,"schema_id":"assetxchain-exp2-phase4-attempt-block-evidence","schema_version":1,"terminal_status":"in-block","transaction_event_indexes":[1,2,3,4,5,6],"transaction_hash":"0x7990aac05c41e276feb62de15d2d783a5ffe8e7e330d934762ee1a84deb8afda"}
