{"complete_block_event_count":12,"events":[{"data":["{\"weight\":{\"refTime\":261973000,\"proofSize\":1493},\"class\":\"Mandatory\",\"paysFee\":\"Yes\"}"],"event_index":0,"method":"ExtrinsicSuccess","phase":"{\"applyExtrinsic\":0}","section":"system"},{"data":["5FLSigC9HGRKVhB9FiEo4Y3koPsNmBmLJbpXg2mp1hXcS59Y","4982567635"],"event_index":1,"method":"Withdraw","phase":"{\"applyExtrinsic\":1}","section":"balances"},{"data":["5FLSigC9HGRKVhB9FiEo4Y3koPsNmBmLJbpXg2mp1hXcS59Y","5D5Do6p4J5T6gnjzK57FNeba5fG1d3UoaHWKCkcWzEcHoBcU","10000000000000"],"event_index":2,"method":"Transfer","phase":"{\"applyExtrinsic\":1}","section":"balances"},{"data":["5D5Do6p4J5T6gnjzK57FNeba5fG1d3UoaHWKCkcWzEcHoBcU","0x13fc39ca3b0530a23551eea36f7d2d6c465e5e2dc45b83f028522954fef0017b90b5ab205c6974c9ea841be688864633dc9ca8a357843eeacf2314649965fe22f2a3b159e24a58c92df7a4aa484a4c6f3121c2484943acdca0f39a2b680bd71900a0724e1809000000000000000000001d000000"],"event_index":3,"method":"ContractEmitted","phase":"{\"applyExtrinsic\":1}","section":"contracts"},{"data":["5D5Do6p4J5T6gnjzK57FNeba5fG1d3UoaHWKCkcWzEcHoBcU","0x13fc39ca3b0530a23551eea36f7d2d6c465e5e2dc45b83f028522954fef0017bf2a3b159e24a58c92df7a4aa484a4c6f3121c2484943acdca0f39a2b680bd71900a0724e180900000000000000000000"],"event_index":4,"method":"ContractEmitted","phase":"{\"applyExtrinsic\":1}","section":"contracts"},{"data":["{\"signed\":\"5FLSigC9HGRKVhB9FiEo4Y3koPsNmBmLJbpXg2mp1hXcS59Y\"}","5D5Do6p4J5T6gnjzK57FNeba5fG1d3UoaHWKCkcWzEcHoBcU"],"event_index":5,"method":"Called","phase":"{\"applyExtrinsic\":1}","section":"contracts"},{"data":["5FLSigC9HGRKVhB9FiEo4Y3koPsNmBmLJbpXg2mp1hXcS59Y","5D5Do6p4J5T6gnjzK57FNeba5fG1d3UoaHWKCkcWzEcHoBcU","23340000000000"],"event_index":6,"method":"StorageDepositTransferredAndHeld","phase":"{\"applyExtrinsic\":1}","section":"contracts"},{"data":["5FLSigC9HGRKVhB9FiEo4Y3koPsNmBmLJbpXg2mp1hXcS59Y","4982567635","0"],"event_index":7,"method":"TransactionFeePaid","phase":"{\"applyExtrinsic\":1}","section":"transactionPayment"},{"data":["{\"weight\":{\"refTime\":4982567282,\"proofSize\":348518},\"class\":\"Normal\",\"paysFee\":\"Yes\"}"],"event_index":8,"method":"ExtrinsicSuccess","phase":"{\"applyExtrinsic\":1}","section":"system"},{"data":["5GrwvaEF5zXb26Fz9rcQpDWS57CtERHpNehXCPcNoHGKutQY","5000000000000"],"event_index":9,"method":"Deposit","phase":"Finalization","section":"balances"},{"data":["5000000000000"],"event_index":10,"method":"Issued","phase":"Finalization","section":"balances"},{"data":["5GrwvaEF5zXb26Fz9rcQpDWS57CtERHpNehXCPcNoHGKutQY","5000000000000","19"],"event_index":11,"method":"RewardPaid","phase":"Finalization","section":"rewards"}],"extrinsic_index":1,"included_block_hash":"0x34ecbc9012c79cec2d248948f5c270cab7ec4b622c0a400931c2bd9f1dc40d0b","included_block_number":19,"parent_block_hash":"0xb7f4dfc843577487de20705e7e1da84a737c76c06ef09bcb4b4d24b57665881b","parent_block_number":18,"schema_id":"assetxchain-exp2-phase4-attempt-block-evidence","schema_version":1,"terminal_status":"in-block","transaction_event_indexes":[1,2,3,4,5,6,7,8],"transaction_hash":"0xba10b9fa255bec2a68cdc18086543e9829501d1b74254a4e5c555262a24ffa17"}
