{"complete_block_event_count":12,"events":[{"data":["{\"weight\":{\"refTime\":261973000,\"proofSize\":1493},\"class\":\"Mandatory\",\"paysFee\":\"Yes\"}"],"event_index":0,"method":"ExtrinsicSuccess","phase":"{\"applyExtrinsic\":0}","section":"system"},{"data":["5GNJqTPyNqANBkUVMN1LPPrxXnFouWXoe2wNSmmEoLctxiZY","1001122225642"],"event_index":1,"method":"Withdraw","phase":"{\"applyExtrinsic\":1}","section":"balances"},{"data":["0x299258c473bc8a96666f1ec312e452df775f246c7dd7ed84b497c4abc6669ac9","0x9a9b94f3c5a1af7163e466a6f19fa869819cc9097825652de4cec94f3f08a24c","IssueRight","0x59c99025eb919b4b25710acbac9316283c2def9ccf6db456637887fd27919ff8"],"event_index":2,"method":"OrderCreated","phase":"{\"applyExtrinsic\":1}","section":"dataAssets"},{"data":["5Cm1sZGQqbtfg7hH4o4feTtv4QjgktgLavxEdjcEEH9SnETx","0x299258c473bc8a96666f1ec312e452df775f246c7dd7ed84b497c4abc6669ac901"],"event_index":3,"method":"ContractEmitted","phase":"{\"applyExtrinsic\":1}","section":"contracts"},{"data":["{\"signed\":\"5GNJqTPyNqANBkUVMN1LPPrxXnFouWXoe2wNSmmEoLctxiZY\"}","5Cm1sZGQqbtfg7hH4o4feTtv4QjgktgLavxEdjcEEH9SnETx"],"event_index":4,"method":"Called","phase":"{\"applyExtrinsic\":1}","section":"contracts"},{"data":["5GNJqTPyNqANBkUVMN1LPPrxXnFouWXoe2wNSmmEoLctxiZY","5Cm1sZGQqbtfg7hH4o4feTtv4QjgktgLavxEdjcEEH9SnETx","31290000000000"],"event_index":5,"method":"StorageDepositTransferredAndHeld","phase":"{\"applyExtrinsic\":1}","section":"contracts"},{"data":["5GNJqTPyNqANBkUVMN1LPPrxXnFouWXoe2wNSmmEoLctxiZY","998200602855"],"event_index":6,"method":"Deposit","phase":"{\"applyExtrinsic\":1}","section":"balances"},{"data":["5GNJqTPyNqANBkUVMN1LPPrxXnFouWXoe2wNSmmEoLctxiZY","2921622787","0"],"event_index":7,"method":"TransactionFeePaid","phase":"{\"applyExtrinsic\":1}","section":"transactionPayment"},{"data":["{\"weight\":{\"refTime\":2921622145,\"proofSize\":85932},\"class\":\"Normal\",\"paysFee\":\"Yes\"}"],"event_index":8,"method":"ExtrinsicSuccess","phase":"{\"applyExtrinsic\":1}","section":"system"},{"data":["5GrwvaEF5zXb26Fz9rcQpDWS57CtERHpNehXCPcNoHGKutQY","5000000000000"],"event_index":9,"method":"Deposit","phase":"Finalization","section":"balances"},{"data":["5000000000000"],"event_index":10,"method":"Issued","phase":"Finalization","section":"balances"},{"data":["5GrwvaEF5zXb26Fz9rcQpDWS57CtERHpNehXCPcNoHGKutQY","5000000000000","19"],"event_index":11,"method":"RewardPaid","phase":"Finalization","section":"rewards"}],"extrinsic_index":1,"included_block_hash":"0x75b57353600ee3026869c35dc737b8c54bca9cac181eb40eb53ee5c22085d970","included_block_number":19,"parent_block_hash":"0x6a84273c88207b06c34994794b41b5d970eb97ba65f930a2ff49b45e6679b3d8","parent_block_number":18,"schema_id":"assetxchain-exp2-phase4-attempt-block-evidence","schema_version":1,"terminal_status":"in-block","transaction_event_indexes":[1,2,3,4,5,6,7,8],"transaction_hash":"0x92e3e0f5a6aaefb480a3ea15b6bb9ba813f5b4abe228c03811ad86d87db52ac4"}
