{"complete_block_event_count":10,"events":[{"data":["{\"weight\":{\"refTime\":261973000,\"proofSize\":1493},\"class\":\"Mandatory\",\"paysFee\":\"Yes\"}"],"event_index":0,"method":"ExtrinsicSuccess","phase":"{\"applyExtrinsic\":0}","section":"system"},{"data":["5GNJqTPyNqANBkUVMN1LPPrxXnFouWXoe2wNSmmEoLctxiZY","4514966714"],"event_index":1,"method":"Withdraw","phase":"{\"applyExtrinsic\":1}","section":"balances"},{"data":["5FxQkMENyMLN8AefJdB4WUiPUTtDCf8CvfgGoztWg5ALL2yK","0x2a54e3c741e9717806a36695dc036da806e0589762ab50675cfd41c985c994da6de0578ed7f29849f1599ab8b0be77a668e632e018c85157bf23f09961e8771d016262626262626262626262626262626262626262626262626262626262626262"],"event_index":2,"method":"ContractEmitted","phase":"{\"applyExtrinsic\":1}","section":"contracts"},{"data":["{\"signed\":\"5GNJqTPyNqANBkUVMN1LPPrxXnFouWXoe2wNSmmEoLctxiZY\"}","5FxQkMENyMLN8AefJdB4WUiPUTtDCf8CvfgGoztWg5ALL2yK"],"event_index":3,"method":"Called","phase":"{\"applyExtrinsic\":1}","section":"contracts"},{"data":["5GNJqTPyNqANBkUVMN1LPPrxXnFouWXoe2wNSmmEoLctxiZY","5FxQkMENyMLN8AefJdB4WUiPUTtDCf8CvfgGoztWg5ALL2yK","32010000000000"],"event_index":4,"method":"StorageDepositTransferredAndHeld","phase":"{\"applyExtrinsic\":1}","section":"contracts"},{"data":["5GNJqTPyNqANBkUVMN1LPPrxXnFouWXoe2wNSmmEoLctxiZY","4514966714","0"],"event_index":5,"method":"TransactionFeePaid","phase":"{\"applyExtrinsic\":1}","section":"transactionPayment"},{"data":["{\"weight\":{\"refTime\":4514966073,\"proofSize\":329489},\"class\":\"Normal\",\"paysFee\":\"Yes\"}"],"event_index":6,"method":"ExtrinsicSuccess","phase":"{\"applyExtrinsic\":1}","section":"system"},{"data":["5GrwvaEF5zXb26Fz9rcQpDWS57CtERHpNehXCPcNoHGKutQY","5000000000000"],"event_index":7,"method":"Deposit","phase":"Finalization","section":"balances"},{"data":["5000000000000"],"event_index":8,"method":"Issued","phase":"Finalization","section":"balances"},{"data":["5GrwvaEF5zXb26Fz9rcQpDWS57CtERHpNehXCPcNoHGKutQY","5000000000000","18"],"event_index":9,"method":"RewardPaid","phase":"Finalization","section":"rewards"}],"extrinsic_index":1,"included_block_hash":"0x05a11440d32ee352d0e63635b28e74541c386a1d358385d119d4823a2970f27e","included_block_number":18,"parent_block_hash":"0x06e2f36efcc36f1865e39ecd42ca606b0069637f24a2ea17a5d69cb29455b926","parent_block_number":17,"schema_id":"assetxchain-exp2-phase4-attempt-block-evidence","schema_version":1,"terminal_status":"in-block","transaction_event_indexes":[1,2,3,4,5,6],"transaction_hash":"0x9e3e46482aef0b926ae39f124a435393b567a55b25adc9dd5ef9bdaabd8b06de"}
