{"complete_block_event_count":8,"events":[{"data":["{\"weight\":{\"refTime\":261973000,\"proofSize\":1493},\"class\":\"Mandatory\",\"paysFee\":\"Yes\"}"],"event_index":0,"method":"ExtrinsicSuccess","phase":"{\"applyExtrinsic\":0}","section":"system"},{"data":["5GNJqTPyNqANBkUVMN1LPPrxXnFouWXoe2wNSmmEoLctxiZY","1395885559"],"event_index":1,"method":"Withdraw","phase":"{\"applyExtrinsic\":1}","section":"balances"},{"data":["0x8a4742471819e20f3e4fa816d16fc69d25c873327dfbc18a32d39a8eb41621bc","0x5151515151515151515151515151515151515151515151515151515151515151","TransferMeta","0x6161616161616161616161616161616161616161616161616161616161616161"],"event_index":2,"method":"OrderCreated","phase":"{\"applyExtrinsic\":1}","section":"marketRuntime"},{"data":["5GNJqTPyNqANBkUVMN1LPPrxXnFouWXoe2wNSmmEoLctxiZY","1395885559","0"],"event_index":3,"method":"TransactionFeePaid","phase":"{\"applyExtrinsic\":1}","section":"transactionPayment"},{"data":["{\"weight\":{\"refTime\":1395885000,\"proofSize\":12184},\"class\":\"Normal\",\"paysFee\":\"Yes\"}"],"event_index":4,"method":"ExtrinsicSuccess","phase":"{\"applyExtrinsic\":1}","section":"system"},{"data":["5GrwvaEF5zXb26Fz9rcQpDWS57CtERHpNehXCPcNoHGKutQY","5000000000000"],"event_index":5,"method":"Deposit","phase":"Finalization","section":"balances"},{"data":["5000000000000"],"event_index":6,"method":"Issued","phase":"Finalization","section":"balances"},{"data":["5GrwvaEF5zXb26Fz9rcQpDWS57CtERHpNehXCPcNoHGKutQY","5000000000000","18"],"event_index":7,"method":"RewardPaid","phase":"Finalization","section":"rewards"}],"extrinsic_index":1,"included_block_hash":"0x26ea66127e2868a075f6c0098fd935a188eb98e34ded3ee849d02aa256388f57","included_block_number":18,"parent_block_hash":"0xf697d519abe1c5a896a3319af371b87c6038a2f637725ce241f8ba986235a93f","parent_block_number":17,"schema_id":"assetxchain-exp2-phase4-attempt-block-evidence","schema_version":1,"terminal_status":"in-block","transaction_event_indexes":[1,2,3,4],"transaction_hash":"0x588baa95656f813829e4ba430af99936a17e04fc59109a05f13f7232e6e79736"}
