{"complete_block_event_count":12,"events":[{"data":["{\"weight\":{\"refTime\":261973000,\"proofSize\":1493},\"class\":\"Mandatory\",\"paysFee\":\"Yes\"}"],"event_index":0,"method":"ExtrinsicSuccess","phase":"{\"applyExtrinsic\":0}","section":"system"},{"data":["5FLSigC9HGRKVhB9FiEo4Y3koPsNmBmLJbpXg2mp1hXcS59Y","1001122225348"],"event_index":1,"method":"Withdraw","phase":"{\"applyExtrinsic\":1}","section":"balances"},{"data":["5FLSigC9HGRKVhB9FiEo4Y3koPsNmBmLJbpXg2mp1hXcS59Y","3000000000000"],"event_index":2,"method":"Reserved","phase":"{\"applyExtrinsic\":1}","section":"balances"},{"data":["0xdd56f3df5da1459f017207664df347cbbc6821cb4c2390800e6654483b823507","0x90b5ab205c6974c9ea841be688864633dc9ca8a357843eeacf2314649965fe22","0x4d3decaed75c4d681ff72e63e6b7bfa778a3a5730ffab9379296b642aa107c7b","3000000000000","31"],"event_index":3,"method":"OrderFunded","phase":"{\"applyExtrinsic\":1}","section":"dataAssets"},{"data":["0xdd56f3df5da1459f017207664df347cbbc6821cb4c2390800e6654483b823507","0x4d3decaed75c4d681ff72e63e6b7bfa778a3a5730ffab9379296b642aa107c7b","3000000000000"],"event_index":4,"method":"PaymentEscrowed","phase":"{\"applyExtrinsic\":1}","section":"dataAssets"},{"data":["{\"signed\":\"5FLSigC9HGRKVhB9FiEo4Y3koPsNmBmLJbpXg2mp1hXcS59Y\"}","5EvLA6eGn9itRSK9zSboZCkJUadN26VE9wMzz2XFKjjkebhD"],"event_index":5,"method":"Called","phase":"{\"applyExtrinsic\":1}","section":"contracts"},{"data":["5FLSigC9HGRKVhB9FiEo4Y3koPsNmBmLJbpXg2mp1hXcS59Y","998140852962"],"event_index":6,"method":"Deposit","phase":"{\"applyExtrinsic\":1}","section":"balances"},{"data":["5FLSigC9HGRKVhB9FiEo4Y3koPsNmBmLJbpXg2mp1hXcS59Y","2981372386","0"],"event_index":7,"method":"TransactionFeePaid","phase":"{\"applyExtrinsic\":1}","section":"transactionPayment"},{"data":["{\"weight\":{\"refTime\":2981372038,\"proofSize\":73925},\"class\":\"Normal\",\"paysFee\":\"Yes\"}"],"event_index":8,"method":"ExtrinsicSuccess","phase":"{\"applyExtrinsic\":1}","section":"system"},{"data":["5GrwvaEF5zXb26Fz9rcQpDWS57CtERHpNehXCPcNoHGKutQY","5000000000000"],"event_index":9,"method":"Deposit","phase":"Finalization","section":"balances"},{"data":["5000000000000"],"event_index":10,"method":"Issued","phase":"Finalization","section":"balances"},{"data":["5GrwvaEF5zXb26Fz9rcQpDWS57CtERHpNehXCPcNoHGKutQY","5000000000000","21"],"event_index":11,"method":"RewardPaid","phase":"Finalization","section":"rewards"}],"extrinsic_index":1,"included_block_hash":"0xe05927f38053638ae78a69105875997ae2913fa9bf3a56324fe0dcabd65fe7b9","included_block_number":21,"parent_block_hash":"0x717dd235c7296c996fc21bb893db9dcf9f76fbe2c5f885f894d1db6dc01f86bb","parent_block_number":20,"schema_id":"assetxchain-exp2-phase4-attempt-block-evidence","schema_version":1,"terminal_status":"in-block","transaction_event_indexes":[1,2,3,4,5,6,7,8],"transaction_hash":"0xf0ab7a1ba0ba2a1c4193aaa3e745874d2ddad3cbc28dc7ab6ffcbe3dedb4ed98"}
